{
  "parallel_researchers": true,
  "models": {
    "scope_challenger": "opus",
    "researcher": "opus",
    "synthesizer": "opus",
    "criteria_generation": "opus",
    "final_report": "opus",
    "devils_advocate": "opus"
  },
  "perspectives": {
    "fixed": [
      "technical",
      "cost",
      "risk",
      "alternatives"
    ],
    "max_dynamic": 2
  },
  "disallowed_tools": {
    "scope_challenger": "WebSearch WebFetch",
    "synthesizer": "WebSearch WebFetch",
    "researcher": "",
    "devils_advocate": "WebSearch WebFetch"
  },
  "timeouts": {
    "scope_challenger_sec": 600,
    "researcher_sec": 1200,
    "synthesizer_sec": 600,
    "criteria_generation_sec": 0,
    "final_report_sec": 600,
    "devils_advocate_sec": 600
  },
  "agent_effort": {
    "scope_challenger": "high",
    "synthesizer": "high",
    "devils_advocate": "high"
  },
  "devils_advocate": {
    "enabled": true,
    "max_reresearch_rounds": 1
  }
}
